<?xml version="1.0"?>

<conf
    xmlns="https://github.com/rv1971/alcamo-scan/conf/"
    xmlns:dc="http://purl.org/dc/terms/"
    xmlns:xsi="http://www.w3.org/2001/XMLSchema-instance"
    xsi:schemaLocation="https://github.com/rv1971/alcamo-scan/conf/ ../../xsd/scan-conf.xsd"
    dc:created="2026-01-06">
  <pathnames
      exiftool="/usr/bin/exiftool"
      lsusb="/usr/bin/exiftool"
      scanimage="/usr/bin/scanimage"/>

  <geometries>
    <geometry id="a4">210x297</geometry>
    <geometry id="a5">148x210</geometry>
    <geometry id="a5r">210x148</geometry>
    <geometry id="a6">105x148</geometry>
    <geometry id="a6r">148x105</geometry>
    <geometry id="a7">74x105</geometry>
    <geometry id="a7r">105x74</geometry>
  </geometries>

  <defaults
      dc:language="en"
      dc:type="Text"
      autopdf="true"
      bufferSize="64"
      format="jpeg"
      geometry="a4"
      mode="color"
      resolution="150"/>

  <!-- example devices -->

  <device
      xsi:type="NetDevice"
      id="epkowa"
      name="epkowa:net:192.168.178.42:1865"
      source="adf"
      supportsXYResolution="true">
    <modes>
      <mode id="binary" backendId="Binary"/>
      <mode id="color"  backendId="Color"/>
      <mode id="gray"   backendId="Gray"/>
    </modes>

    <sources>
      <source id="adf" backendId="Automatic Document Feeder" isAdf="true"/>
      <source id="flatbed" backendId="Flatbed"/>
    </sources>
  </device>

  <device
      xsi:type="UsbDevice"
      id="fooscan"
      usbId="ffff:0000"
      backend="genesys">
    <modes>
      <mode id="binary" backendId="Lineart"/>
      <mode id="color"  backendId="Color"/>
      <mode id="gray"   backendId="Gray"/>
    </modes>
  </device>
</conf>
